{
  "type": "message",
  "id": "m2",
  "parentId": "m1",
  "timestamp": "2026-09-10T12:00:00Z",
  "message": {
    "role": "user",
    "content": [
      {
        "type": "tool_result",
        "tool_use_id": "droid-call-1",
        "content": "Test failed.",
        "is_error": true
      }
    ]
  }
}
